Gap_ID,Data_Item,Filing_Section,Expected_File,Priority,Status,Retrieval_Attempt_1,Command_1,Result_1,Retrieval_Attempt_2,Command_2,Result_2,Notes
GAP-01,Off-Balance-Sheet Credit Exposures,Note 3 or Note 4,relevant_notes.txt,HIGH,UNRESOLVED,Read relevant_notes.txt search for credit risk,SEDGAR notes topic=credit,Partial — Note 3 tables retrieved but off-balance-sheet commitment granularity not visible in text extraction,Manual 10-K source review recommended,N/A,Note 3 confirmed as Loans Note; off-Balance sheet data requires SEC EDGAR XBRL viewer for commitment detail,Note 3 is the Loans and Related Allowance for Credit Losses note
GAP-02,PCL / Net Charge-Off Detail by Portfolio Segment (3-yr),Note 3,relevant_notes.txt,MEDIUM,PARTIAL,Read financial_statements.txt,Direct CSV from risk_research.py,PCL total line item present (FY2025:$779M, FY2024:$789M, FY2023:$742M),Disaggregated PCL by segment not in raw text extraction,SEDGAR notes topic=loans detail=full,Note tables referenced but full tabular detail not rendered as text; only narrative extracted,Disaggregated data can be sourced via direct 10-K XBRL viewer
GAP-03,Risk Committee Charter / Meeting Frequency,DEF 14A proxy governance,proxy_governance.txt,MEDIUM,PARTIAL,Read proxy_governance.txt,Direct text from risk_research.py proxy snippet,Risk Committee duties and CRO reporting confirmed; meeting frequency not explicitly stated,Read edgar_proxy form=DEF 14A,Governance data returned per section; meeting frequency requires full source document review,"Proxy confirms Risk Committee oversees ERM; meeting count per proxy: not disclosed"
GAP-04,TH Note 37 Cybersecurity Full Disclosure (XBRL),10-K Item 1C / Note 37,relevant_notes.txt,MEDIUM,UNRESOLVED,Read relevant_notes.txt search for cybersecurity,SEDGAR notes topic=cybersecurity,Note 37 title confirmed as Cybersecurity Risk Management and Strategy Disclosure; body returned as None — XBRL note body not rendered,Disclosure verified via proxy and Item 1A verbatim cyber language,edgar_read sections for Item 1C,N/A,"Proxy and Item 1A provide cyber governance context; specific Note 37 XBRL table values not retrievable in text mode"
GAP-05,Branch and Geographic Network Detail,Item 1,item_1_business.txt,LOW,UNRESOLVED,Read item_1_business.txt coast-to-coast description,Direct text from risk_research.py,Coast-to-coast branch network and 4 international offices confirmed but no branch count or state list provided in text,N/A,N/A,N/A,No explicit branch enumeration in Item 1 text
GAP-06,CCAR / DFAST Stress Test Quantitative Results,Item 7A / Note 19,item_1_business.txt,LOW,UNRESOLVED,Read item_1_business.txt for CCAR language,Direct text,SCB of 2.5% confirmed; no detailed CCAR quantitative loss estimates disclosed in 10-K text,N/A,N/A,N/A,CCAR quantitative outputs available from Federal Reserve public release; not reproduced in 10-K
GAP-07,CET1 / Tier 1 / Total Capital Ratio Specific Values,Item 7A / Note 19,item_1_business.txt,LOW,UNRESOLVED,Read item_1_business.txt regulatory capital section,Direct text,"Minimum ratios stated (CET1 4.5%, Tier1 6.0%, Total 8.0%); actual reported CET1 ratio not stated as a specific number in text excerpt,Only ""exceeded the required ratios for well capitalized"" stated,"Use yfinance or EDGAR XBRL for reported ratio values,Actual regulatory capital ratios available via XBRL data; qualitative disclosure present
