Gap_ID,Data_Item,Filing_Section,Expected_File,Priority,Status,Retrieval_Attempt_1,Command_1,Result_1,Retrieval_Attempt_2,Command_2,Result_2,Notes
G1,CET1_Ratio,Item 8 / Note 23,financial_statements.txt,HIGH,UNRESOLVED,Read financial_statements.txt and relevant_notes.txt,read tool,Not present in extracted notes,edgar_filing notes topic="capital",edgar_edgar_notes,"Success but no CET1 value extracted","Requires reading Note 23 in full from SEC filing"
G2,Provision_for_Credit_Losses_PCL,Note 7 Income Statement,financial_statements.txt,MEDIUM,UNRESOLVED,Read financial_statements.txt,read tool,Not itemized separately in extracted IS,edgar_filing with form="10-K",edgar_edgar_read sections=["financials"],Partial,"Note 7 covers bank loans and allowance; PCL figure requires full Note 7"
G3,Note_37_Cybersecurity_Disclosure,Note 37,relevant_notes.txt,HIGH,UNRESOLVED,Search for "cybersecurity" in relevant_notes.txt,read tool,"Note not found in extracted notes (returned 'None')",edgar_filing form="10-K" then .notes,edgar_edgar_notes,"Matches Note 37 not in top results","No explicit Note 37 text in raw dump; 10-K has 29 notes total"
G4,CRO_Name_and_Title,Proxy Governance,proxy_governance.txt,MEDIUM,UNRESOLVED,Read proxy_governance.txt,read tool,Not named in extracted proxy snippets,edgar_filing form="DEF 14A",edgar_edgar_read sections=["governance"],Partial,"Governance data confirms Risk Committee members and chair; CRO not named explicitly"
G5,Litigation_Note_30_Itemized_Proceedings,Item 8 / Note 30,relevant_notes.txt,MEDIUM,UNRESOLVED,Search for "litigation" in relevant_notes.txt,read tool,"No matching note found",edgar_notes topic="litigation",edgar_edgar_notes,Not attempted (Note 15 referenced not 30),"Legal proceedings described in Note 15 of Item 8; item_3_legal.txt refers to Note 15"
G6,Global_Rank_by_Total_Assets,External ranking,N/A,LOW,UNRETRIEVABLE,tavily_search for global rank,tavily-mcp_tavily_search,Not run in this protocol,N/A,N/A,N/A,"Global rankings not required in-house; sector peer comparison completed via edgar_compare"
